Title,Date,Affiliations,Description,Response,Victims,Sponsor,Type,Category,Sources_1,Sources_2,Sources_3
RUAG espionage,5/23/2016,Believed to be the work of the Turla group,A threat actor compromised a Swiss defense contractor.,,Switzerland,Russian Federation,Espionage,Private sector,https://www.govcert.admin.ch/blog/22/technical-report-about-the-ruag-espionage-case,https://www.theregister.co.uk/2016/05/24/anatomy_of_a_breach_swiss_cert_publishes_analysis_of_ruag_attack/,
Operation Mermaid,7/7/2016,,This threat actor is based in the Middle East (possibly Iran) and targets English- and Persian-language organizations. It is alleged to be the same group behind a compromise of the Danish Ministry of Foreign Affairs.,,"Ministry of Foreign Affairs, Iran,",,Espionage,Government,https://ti.360.com/upload/report/file/mryxdgkb20160707en.pdf,,
Yahoo breach (2016),12/14/2016,Same state sponsor as the 2014 breach,"A threat actor exploited a vulnerability in Yahoo's account log-in process, allowing it to access user accounts without a password. Approximately thirty-two million accounts were affected.",Criminal charges   https://www.justice.gov/opa/pr/us-charges-russian-fsb-officers-and-their-criminal-conspirators-hacking-yahoo-and-millions,Yahoo,Russian Federation,Espionage,Private sector,https://investor.yahoo.net/releasedetail.cfm?ReleaseID=1004285,https://www.justice.gov/opa/pr/us-charges-russian-fsb-officers-and-their-criminal-conspirators-hacking-yahoo-and-millions,https://www.theregister.co.uk/2017/02/16/yahoo_forged_cookie_hack_risk/
Project Sauron,7/8/2016,Also known as Strider,"This threat actor compromises targets in the Military, telecommunications, and financial sectors in Belgium, China, Iran, Russia, Sweden, and elsewhere.",,"Russia, Belgium, Sweden, Iran, China, Rwanda",United States,Espionage,"Government, Military",https://securelist.com/analysis/publications/75533/faq-the-projectsauron-apt/,https://www.symantec.com/connect/blogs/strider-cyberespionage-group-turns-eye-sauron-targets,https://arstechnica.com/security/2016/08/researchers-crack-open-unusually-advanced-malware-that-hid-for-5-years/
Compromise of entities involved in the China-Philippines territorial dispute,7/12/2016,,"A threat actor targeted the Department of Justice of the Philippines, the Asia-Pacific Economic Cooperation (APEC), and a major international law firm representing one of the parties in the dispute over the Scarborough Shoal.",,Philippines,China,Espionage,"Government, Private sector",https://www.f-secure.com/documents/996508/1030745/nanhaishu_whitepaper.pdf,,
Operation Sphinx,7/21/2016,,This threat actor targets government and military organizations in Egypt and Israel for espionage purposes.,,"Egypt, Israel",,Espionage,"Government, Military",https://ti.360.com/upload/report/file/rmsxden20160721.pdf,,
"Compromise of computer networks associated with diplomats, journalists, and others in South Korea",8/1/2016,,"Threat actors targeted the email accounts of South Korean diplomats, journalists, and security officials.",Denouncement   http://english.yonhapnews.co.kr/news/2016/08/01/0200000000AEN20160801001152315.html,South Korea,Korea (Democratic People's Republic of),Espionage,Government,http://english.yonhapnews.co.kr/news/2016/08/01/0200000000AEN20160801001152315.html,http://www.theregister.co.uk/2016/08/03/norks_target_90_seoul_officials_journalists_pop_53_email_accounts/,
Compromise of a mobile app used by Ukrainian artillery units,12/22/2016,Believed to be the work of APT 28,A threat actor compromised a mobile app that Ukrainian artillery units used to assist with targeting. The compromise of the app is believed to have allowed the threat actor to monitor the movements of Ukrainian units in order to facilitate military targeting by Russian-backed rebels in eastern Ukraine.,Denial   http://www.mil.gov.ua/news/2017/01/06/informacziya-po-vtrati-u-zs-ukraini-80-gaubicz-d-30%E2%80%9D-ne-vidpovidae-dijsnosti/,Ukraine Armed Forces,Russian Federation,Espionage,Military,https://www.crowdstrike.com/wp-content/brochures/FancyBearTracksUkrainianArtillery.pdf,,
APT 16,12/16/2016,,"This threat actor targets and compromises Japanese and Taiwanese entities in the finance, tech, media, and government sectors.",,"Japan, Taiwan",China,Espionage,Private sector,https://www.fireeye.com/blog/threat-research/2015/12/the_eps_awakens.html,https://www.fireeye.com/blog/threat-research/2015/12/the-eps-awakens-part-two.html,
Targeting of Kazakh dissidents,8/2/2016,,Threat actors targeted lawyers and exiled Kazakh dissidents for the purpose of espionage.,,Kazakh dissidents,Kazakhstan,Espionage,Civil society,http://www.reuters.com/article/us-kazakhstan-cyber-idUSKCN10D1N2,https://www.eff.org/files/2016/08/03/i-got-a-letter-from-the-government.pdf,
Attempted compromise of U.S. think tanks,11/9/2016,Believed to be the work of the Dukes,A threat actor attempted to compromise the networks of U.S. think tanks associated with international affairs and national security. The attempts occurred shortly after the U.S. election in 2016.,,"Council on Foreign Relations, Brookings Institution",Russian Federation,Espionage,Civil society,https://www.volexity.com/blog/2016/11/09/powerduke-post-election-spear-phishing-campaigns-targeting-think-tanks-and-ngos/,,
Compromise of a power grid in eastern Ukraine,12/23/2015,Possible link to Sandworm.,"In December 2015, a threat actor compromised power distribution companies in western Ukraine, causing a power outage for more than 230,000 residents. Several control centers were targeted by suspected Russian hackers, who were able to siphon operator credentials and gain access to the power grid for the Ivano-Frankivsk region. The power outage lasted as long as six hours in some areas. During the outage, threat actors also flooded customer services phone lines with calls to prevent customers from reporting the incident.

The compromise of the Ukrainian power grid was an escalation from previous disruptive incidents and the first confirmed cyber operation to successfully take down energy infrastructure. The incident set an ominous precedent for the security of power grids around the world. The electricity distribution system in Ukraine was again targeted in 2016.",Denouncement   http://www.reuters.com/article/us-ukraine-cybersecurity-idUSKCN0VL18E,Prikarpattiaoblenergo Electric Company,Russian Federation,Sabotage,Private sector,https://ics.sans.org/blog/2016/01/09/confirmation-of-a-coordinated-attack-on-the-ukrainian-power-grid,https://ics.sans.org/media/E-ISAC_SANS_Ukraine_DUC_5.pdf,https://www.wired.com/2016/03/inside-cunning-unprecedented-hack-ukraines-power-grid/
APT 30,4/12/2015,"Also known as Naikon, PLA Unit 78020, Lotus Panda. Possibly responsible for the JadeRAT tool.?",This threat actor uses spear-phishing techniques to target government and private sector agencies in the South China Sea region.,,"India, Thailand, South Korea, Saudi Arabia, Malaysia, United States, Vietnam, Cambodia, Indonesia, Myanmar, China, Laos, Singapore, Phillipines",China,Espionage,"Government, Private sector",https://www2.fireeye.com/rs/fireye/images/rpt-apt30.pdf,https://securelist.com/analysis/publications/69953/the-naikon-apt/,http://cdn2.hubspot.net/hubfs/454298/Project_CAMERASHY_ThreatConnect_Copyright_2015.pdf?t=1443030820943&submissionGuid=81f1c199-859f-41e9-955b-2eec13777720
Goblin Panda,6/1/2015,,This threat actor targets government agencies and entities in the defense and energy sectors in Southeast Asia with an interest in issues related to tensions in the South China Sea.,,Vietnam,China,,"Government, Private sector",https://www.crowdstrike.com/blog/rhetoric-foreshadows-cyber-activity-in-the-south-china-sea/,https://www.crowdstrike.com/blog/meet-crowdstrikes-adversary-of-the-month-for-august-goblin-panda/,
Compromise of Anthem,2/6/2015,Believed to be the work of Deep Panda,"A threat actor compromised a U.S. health insurance company, resulting in compromised personal data on eighty million customers.",Criminal charges   https://www.justice.gov/opa/press-release/file/1161466/download,Anthem,China,Espionage,Private sector,http://money.cnn.com/2015/02/04/technology/anthem-insurance-hack-data-security/,http://www.nytimes.com/2015/02/05/business/hackers-breached-data-of-millions-insurer-says.html,http://www.usatoday.com/story/tech/2015/02/04/health-care-anthem-hacked/22900925/
Gamaredon,4/28/2015,Also known as the Gamaredon Group and?Primitive Bear.,A Russian-linked threat group known as Gamaredon uses custom-developed malware in attacks aimed at Ukraine. The group has been active since at least 2013. Also known as Invisimole.,,Ukraine,Russian Federation,Espionage,Government,https://www.securityweek.com/gamaredon-group-uses-custom-malware-ukraine-attacks,https://unit42.paloaltonetworks.com/unit-42-title-gamaredon-group-toolset-evolution/,https://www.lookingglasscyber.com/wp-content/uploads/2015/08/Operation_Armageddon_Final.pdf
Ocean Lotus,5/31/2015,Also known as APT 32,"This threat actor,?known to use watering-hole attacks to compromise victims, targets organizations of interest to the Vietnamese government for espionage purposes. Victims have included human rights organizations, research institutes and maritime construction firms in China, and media organizations. Also believed?to have been responsible for disclosing confidential Filipino?government documents.?",,"China, United States, Philippines, Germany, Vietnam, Association of Southeast Asian Nations, Cambodia, Laos",Vietnam,Espionage,"Government, Private sector, Civil society",https://ti.360.com/upload/report/file/OceanLotus_Report-en-6.2.2.pdf,https://www.fireeye.com/blog/threat-research/2017/05/cyber-espionage-apt32.html,https://www.wired.com/2017/05/close-look-notorious-apt32-hacking-group-action/
Duqu 2.0,6/10/2015,Associated with Duqu. Believed to have been the tool used to compromise Kaspersky Labs.,"A threat actor, using a tool dubbed Duqu 2.0, targeted individuals and companies linked to the P5+1 (the five permanent member states of the UN Security Council, plus Germany), which was conducting negotiations on Iran's nuclear program.",,Iran,Israel,Espionage,"Government, Private sector",https://securelist.com/blog/research/70504/the-mystery-of-duqu-2-0-a-sophisticated-cyberespionage-actor-returns/,https://securelist.com/files/2015/06/The_Mystery_of_Duqu_2_0_a_sophisticated_cyberespionage_actor_returns.pdf,http://www.wsj.com/articles/spy-virus-linked-to-israel-targeted-hotels-used-for-iran-nuclear-talks-1433937601
Chafer,12/7/2015,Believed to use similar tools and infrastructure as OilRig,"This threat actor targets organizations in the aerospace, technology, telecommunications, and engineering sectors for the purpose of espionage.",,"Saudi Arabia, United Arab Emirates, Israel, Jordan, Turkey",Iran (Islamic Republic of),Espionage,Private sector,https://www.symantec.com/blogs/threat-intelligence/chafer-latest-attacks-reveal-heightened-ambitions,https://www.symantec.com/connect/blogs/iran-based-attackers-use-back-door-threats-spy-middle-eastern-targets,
APT 3,6/23/2015,"Also known as UPS, Gothic Panda, Buckeye, and Boyusec","This threat actor targets and compromises entities in the defense, construction, technology, and transportation sectors. Up until 2015, it was primarily focused on U.S. and UK entities, but it shifted to Hong Kong??ased targets afterward.?The U.S. Department of Justice indicted three members of this threat actor group in November 2017 for compromising the networks of three U.S. companies.",,"United States, United Kingdom, Hong Kong",China,Espionage,Private sector,https://www.fireeye.com/blog/threat-research/2015/06/operation-clandestine-wolf-adobe-flash-zero-day.html,http://www.secureworks.com/resources/blog/research/threat-group-0110-targets-manufacturing-and-financial-organizations-via-phishing/,http://www.symantec.com/connect/blogs/buckeye-cyberespionage-group-shifts-gaze-us-hong-kong
"Targeting of Ugandan political opposition members, journalists, and activists",10/16/2015,The government of Uganda,"The government of Uganda, under the Yoweri Museveni administration, used FinFisher, an advanced spyware developed by Gamma Group, to quell political unrest that resulted from allegations of corruption and police brutality after the 2011 general election.",,Uganda,Uganda,Espionage,Civil society,https://www.theverge.com/2015/10/16/9549151/uganda-finfisher-surveillance-spyware-privacy-international,https://privacyinternational.org/sites/default/files/2017-12/Uganda_Report_1.pdf,
Emissary Panda,8/5/2015,"Also known as TG-3390, APT 27, TEMP.Hippo, and?LuckyMouse.?Believed to have been responsible for the compromise of a Mongolian data center.","This threat actor compromises web pages to lure targets for espionage purposes. It focuses on the aerospace, automotive, technology, and energy sectors, primarily in the United States and United Kingdom.",,"United States, United Kingdom, France",China,Espionage,"Government, Private sector",https://www.secureworks.com/research/threat-group-3390-targets-organizations-for-cyberespionage,https://www.erai.com/CustomUploads/ca/wp/2015_12_wp_operation_iron_tiger.pdf,https://www.threatconnect.com/blog/threatconnect-discovers-chinese-apt-activity-in-europe/
Compromise of TV5 Monde,4/9/2015,Suspected to be the work of APT 28,"In May 2015, threat actors compromised French television network TV5 Monde, disrupting broadcasts for three hours and gaining access to the network?? social media accounts. A group allegedly allied with the self-declared Islamic State and calling itself the Cyber Caliphate initially claimed responsibility for the incident. However, later investigations revealed links to Russian hacking group APT 28.

TV5 Monde is an example of a ??alse flag??operation, whereby a threat actor tries to mask its identity by leaving clues or attributes that would cause the victim to pin the blame on someone else. The threat actors behind TV5 Monde were successful enough in their flagging to lead French authorities to believe the incident was a terrorist attack. It is unknown why Russia would have conducted a false flag operation in France disguising itself as the Islamic State.?

In October 2018, the UK government announced that this incident was the work of Russian military intelligence.",Denouncement   http://www.thelocal.fr/20150409/frances-tv5-monde-isis-cyberattack-charlie-hebdo,TV5 Monde,Russian Federation,Defacement,Private sector,https://www.theguardian.com/world/2015/apr/09/french-tv-network-tv5monde-hijacked-by-pro-isis-hackers,http://www.lexpress.fr/actualite/medias/piratage-de-tv5-monde-la-piste-russe_1687673.html,https://www.crowdstrike.com/blog/bears-midst-intrusion-democratic-national-committee/
Targeting of the government of Thailand,11/24/2015,Believed to be the work of?Winnti Umbrella,"A threat actor used a tool called Bookworm to compromise government agencies in Thailand, for the purpose of espionage.",,Thailand,China,Espionage,Government,https://researchcenter.paloaltonetworks.com/2015/11/attack-campaign-on-the-government-of-thailand-delivers-bookworm-trojan/,https://researchcenter.paloaltonetworks.com/2015/11/bookworm-trojan-a-model-of-modular-architecture/,https://401trg.com/burning-umbrella/
APT 17,5/14/2015,Also known as Deputy Dog and Axiom.?Believed to be associated with Winnti Umbrella,"This threat actor targets U.S. government entities, the defense industrial base, law firms, information technology companies, resource extraction companies, and nongovernmental organizations.?Ethical hacking group Intrusion Truth doxed three members of this threat actor: two hackers plus the head of four Chinese companies who is also believed to be an officer of the Chinese Ministry of State Security (MSS). The hackers are believed to be operating as contractors for the Jinan bureau of the Chinese MSS, where they carry out on-demand hacking operations.",,United States,China,Espionage,"Government, Private sector, Civil society",https://www2.fireeye.com/rs/fireye/images/APT17_Report.pdf,,
Rocket Kitten,11/9/2015,Possibly?linked to?Saffron Rose,"This threat actor targets defense contractors and academic institutions in Israel, European government agencies, and civil society actors. It seeks out material related to diplomacy, defense, security, journalism, and human rights for espionage purposes.",,"Saudi Arabia, Israel, Yemen, Venezuela, Iraq, United Kingdom, Afghanistan, Kuwait, Egypt, United Arab Emirates, Turkey, Syria, Iran, Canada, Jordan",Iran (Islamic Republic of),Espionage,"Government, Military",http://blog.checkpoint.com/wp-content/uploads/2015/11/rocket-kitten-report.pdf,https://www.trendmicro.com/cloud-content/us/pdfs/security-intelligence/white-papers/wp-the-spy-kittens-are-back.pdf,https://citizenlab.org/2015/08/iran_two_factor_phishing/
Compromise of the networks at the German parliament (Bundestag),5/29/2015,Believed to be the work of APT 28,"A threat actor compromised the networks of the German parliament for the purpose of espionage.?In May 2020, Germany?? federal prosecutor issued an arrest warrant against Russian citizen Dmitry Badin, who is believed to be a member of Russia?? elite hacking unit, APT 28. Afterward, Germany asked European Union governments to impose the bloc?? first cyber sanctions on Badin.",Denouncement   http://www.reuters.com/article/us-germany-russia-cyber-idUSKCN0Y41FC,Bundestag,Russian Federation,Espionage,Government,http://www.dw.com/en/data-stolen-during-hack-attack-on-german-parliament-berlin-says/a-18486900,http://www.reuters.com/article/us-germany-russia-cyber-idUSKCN0Y41FC,http://www.wsj.com/articles/german-parliament-struggles-to-purge-hackers-from-computer-network-1434127532
Equation Group,2/16/2015,"Also known as Tilded Team, it is associated with Flame, Stuxnet, Regin, Gauss, and Duqu.","In 2015, Moscow-based Kaspersky Lab published a report on the Equation Group, a threat actor active since 2001 [PDF]. It was responsible for infecting approximately five hundred systems in at least forty-two countries. The malware used by Equation Group had the ability to reprogram hard drives and then self-destruct, which made the operations effectively invisible and indestructible. Targeted systems ranged from the private to the public sector, from energy departments to military operations to media outlets.

The tools and scope of the Equation Group suggest that it is one of the most sophisticated threat actors operating in cyberspace. Many believe that Equation Group is a state-sponsored entity, such as the U.S. National Security Agency or a joint effort between it and its Five Eyes allies.",,"Iran, Russia, Pakistan, Afghanistan, India, China, Syria, Mali, Lebanon, Yemen, Algeria, United Arab Emirates, Kenya, United Kingdom, Libya",United States,Espionage,"Government, Military",https://securelist.com/blog/research/68750/equation-the-death-star-of-malware-galaxy/,http://www.reuters.com/article/us-usa-cyberspying-idUSKBN0LK1QV20150216,http://arstechnica.com/security/2015/02/how-omnipotent-hackers-tied-to-the-nsa-hid-for-14-years-and-were-found-at-last/
Compromise of a Pentagon legacy system,6/4/2015,Suspected to be the work of the Dukes,A threat actor compromised a legacy unclassified network at the Department of Defense.,Denouncement   http://www.defense.gov/News/Transcripts/Transcript-View/Article/607043,Pentagon,Russian Federation,Espionage,Military,http://www.defense.gov/News/Transcripts/Transcript-View/Article/607043,http://www.cnn.com/2015/04/23/politics/russian-hackers-pentagon-network/,https://fcw.com/Articles/2015/04/23/Carter-Russian-hack.aspx
Compromise at the Office of Personnel Management,7/10/2015,Suspected to be the work of Deep Panda,"A threat actor compromised the networks of the U.S. Office of Personnel Management, exposing the data of at least 22.1 million people who have applied for a U.S. security clearance.",Unknown   http://www.nytimes.com/2015/08/01/world/asia/us-decides-to-retaliate-against-chinas-hacking.html?_r=0,Office of Personnel Management,China,Espionage,Government,http://www.nytimes.com/2014/07/10/world/asia/chinese-hackers-pursue-key-data-on-us-workers.html?_r=0,http://www.tripwire.com/state-of-security/security-data-protection/cyber-security/the-opm-breach-timeline-of-a-hack/,https://www.washingtonpost.com/news/federal-eye/wp/2015/07/09/hack-of-security-clearance-system-affected-21-5-million-people-federal-authorities-say/
Hellsing,4/15/2015,Possibly uses the same infrastructure as?Mirage,"This threat actor uses spear-phishing techniques to compromise diplomatic targets in Southeast Asia, India, and the United States. It also seems to have targeted the APT 30.",,"Malaysia, Philippines, India, Indonesia, United States",China,Espionage,Government,https://securelist.com/analysis/publications/69567/the-chronicles-of-the-hellsing-apt-the-empire-strikes-back/,http://arstechnica.com/security/2015/04/elite-cyber-crime-group-strikes-back-after-attack-by-rival-apt-gang/,
Compromise of an unclassified network associated with the U.S. Joint Chiefs of Staff,7/28/2015,Believed to be the work of APT 28,A threat actor compromised an unclassified network used by the U.S. Joint Chiefs of Staff for espionage purposes.,,Joint Chiefs of Staff,Russian Federation,Espionage,Military,http://www.cnn.com/2015/07/28/politics/pentagon-takes-computer-system-offline/,http://www.cnbc.com/2015/08/06/russia-hacks-pentagon-computers-nbc-citing-sources.html,http://www.wsj.com/articles/nsa-chief-says-cyberattack-at-pentagon-was-sophisticated-persistent-1441761541
Compromise of United Airlines,7/29/2015,Suspected to be the work of Deep Panda,"A threat actor compromised the network of United Airlines for espionage purposes, gaining access to flight manifests.",,United Airlines,China,Espionage,Private sector,https://web.archive.org/web/20170112223302/https://www.bloomberg.com/news/articles/2015-07-29/china-tied-hackers-that-hit-u-s-said-to-breach-united-airlines,https://www.sans.org/reading-room/whitepapers/breaches/united-airlines-2015-data-breach-suggested-near-mid-long-term-mitigating-actions-th-36452,
Targeting of Ukrainian law enforcement and government officials,3/13/2015,,A threat actor attempted to compromise Ukrainian officials in government and law enforcement for espionage purposes. Ukrainian intelligence claims this was done in support of Russian-backed military activities in eastern Ukraine.,Denouncement   http://www.sbu.gov.ua/sbu/control/en/publish/article?art_id=138949&amp;cat_id=35317,Ukraine,Russian Federation,Espionage,"Military, Government",https://web.archive.org/web/20150319104801/http://www.sbu.gov.ua/sbu/control/en/publish/article?art_id=138949&cat_id=35317,,
Compromise of the Seoul subway system,10/5/2015,Believed to be the work of the same actors behind Dark Seoul?and possibly linked to Onion Dog,A threat actor compromised networks associated with Seoul's subway system.,Denouncement   http://www.koreaherald.com/view.php?ud=20151005001125,Seoul Subway System,Korea (Democratic People's Republic of),Espionage,Government,http://www.koreaherald.com/view.php?ud=20151005001125,,
Disruption of GitHub,3/27/2015,,"A threat actor launched a denial of service attack against GitHub to prevent access to internet content banned in China, such as the New York Times. The incident was the first in which threat actors, believed to be associated with the government of China, used a tool dubbed the Great Cannon.",,GitHub,China,Denial of service,Private sector,http://arstechnica.com/security/2015/04/ddos-attacks-that-crippled-github-linked-to-great-firewall-of-china/,https://citizenlab.org/2015/04/chinas-great-cannon/,http://www.techrepublic.com/article/chinese-government-linked-to-largest-ddos-attack-in-github-history/
Compromise of the Permanent Court of Arbitration's website,10/16/2015,,"A threat actor compromised the website of the Permanent Course of Arbitration for espionage purposes, intending to compromise visitors to the website.",,Permanent Court of Arbitration,China,Espionage,Government,https://web.archive.org/web/20151031022526/https://threatconnect.com/china-hacks-the-peace-palace-all-your-eezs-are-belong-to-us/,https://web.archive.org/web/20170519164504/https://www.bloomberg.com/news/articles/2015-10-15/chinese-cyber-spies-fish-for-enemies-in-south-china-sea-dispute,
Compromise of unclassified White House networks,4/7/2015,Suspected to be the work of the Dukes,Threat actors compromised unclassified White House networks using access from compromised networks at the State Department.,,"White House, U.S Department of State",Russian Federation,Espionage,Government,http://www.usatoday.com/story/news/2015/04/07/cnn-reports-white-house-hacked/25432021/,http://www.forbes.com/sites/thomasbrewster/2015/04/08/russians-hacked-white-house-cnn/#44f700cf2c68,http://www.nytimes.com/2015/04/26/us/russian-hackers-read-obamas-unclassified-emails-officials-say.html?_r=0
Compromise of South Korean government computers (2015),10/20/2015,,"A threat actor compromised government networks affiliated with members of the South Korean parliament. The threat actor also attempted to compromise the Foreign Ministry, Defense Ministry, and the Blue House.",Denouncement   http://www.upi.com/Top_News/World-News/2015/10/20/Spy-agency-North-Korea-hackers-stole-sensitive-South-Korean-data/9041445353950/,Members of the National Assembly,Korea (Democratic People's Republic of),Espionage,Government,http://www.upi.com/Top_News/World-News/2015/10/20/Spy-agency-North-Korea-hackers-stole-sensitive-South-Korean-data/9041445353950/,http://www.scmagazine.com/north-korean-hackers-breach-south-koreas-executive-office-servers/article/448582/,
