Title,Date,Affiliations,Description,Response,Victims,Sponsor,Type,Category,Sources_1,Sources_2,Sources_3
Targeting of dissidents and opposition political candidates in Ghana,1/20/2022,Believed to be the work of Ghana's government,"The Israeli spyware firm NSO Group sold Pegasus spyware to the government of Ghana, which used the tools to spy on political opponents and dissidents. Ghana's intelligence agency launched an investigation into the spyware allegations. NSO Group has claimed that although Ghana bought the spyware, it was never actually used in the country.?",Denial   https://www.haaretz.com/israel-news/tech-news/nso-ghana-op-exposed-never-before-seen-pegasus-spyware-footage-workers-passports-1.10553725,Political dissidents and opposition leaders in Ghana,Ghana,Espionage,Civil society,https://www.haaretz.com/israel-news/tech-news/2022-01-20/ty-article/nso-ghana-op-exposed-never-before-seen-pegasus-spyware-footage-workers-passports/0000017f-f1fb-df98-a5ff-f3ffb9a20000,,
Targeting of Ukrainian state entities,3/7/2022,UNC1151,"The Belarusian threat actor UNC1151 targeted multiple Ukrainian government agencies with a backdoor called MicroBackdoor. The malware??as delivered via phishing emails that included a bait image and files containing malicious code. The backdoor and loader were created in January 2022, before Russia?? invasion of Ukraine.??",,Ukrainian state entities,Belarus,Espionage,Government,https://cert.gov.ua/article/37626,,
Targeting of Russian and Belarusian websites,5/4/2022,Ukrainian IT Army,Ukraine?? IT Army compromised Docker Engine honeypots in an attempt to execute distributed denial-of-service (DDoS) attacks against Russian and Belarusian websites.,,"Russian and Belarusian websites were targeted, including those belonging to government, military, media, finance, energy, retail, mining, manufacturing, chemicals, production, technology, advertisements, agriculture, transportation, and political parties.",Ukraine,Denial of service,"Government, Private sector, Civil society",https://www.crowdstrike.com/blog/compromised-docker-honeypots-used-for-pro-ukrainian-dos-attack/,,
Targeting of the Belgian Federal Public Service Interior in Chinese espionage campaign,7/18/2022,Zirconium,Chinese threat actors targeted the Belgian Federal Public Service Interior as part of a wide-ranging cyberespionage campaign involving multiple threat actors. Belgian authorities condemned the activity.,Denouncement   https://diplomatie.belgium.be/en/news/declaration-minister-foreign-affairs-malicious-cyber-activities,Belgian Federal Public Service Interior,China,Espionage,Government,https://diplomatie.belgium.be/en/news/declaration-minister-foreign-affairs-malicious-cyber-activities,https://www.bleepingcomputer.com/news/security/belgium-says-chinese-hackers-attacked-its-ministry-of-defense/,
Targeting of Ukrainian government agencies,8/11/2022,Gamaredon,"The Computer Emergency Response Team of Ukraine found that Gamaredon had been breaking into Ukrainian government email accounts.
?",Confirmation,Ukrainian government agencies,Russian Federation,Espionage,Government,https://cert.gov.ua/article/2681855,,
Targeting of Palestinian entities and activists,2/2/2022,APT-C-23,The Hamas-linked threat actor APT-C-23 used malware embedded in politically themed decoy files and documents to install backdoors on the systems of targeted Palestinian individuals and organizations.??,,,,Espionage,Civil society,https://www.cyberscoop.com/palestinian-targeted-arid-viper-hamas/,https://blog.talosintelligence.com/2022/02/arid-viper-targets-palestine.html,
Targeting of government agencies in the European Union,4/5/2022,Gamaredon,"Russian threat actor Gamaredon targeted Ukrainian organizations in a phishing campaign. The hackers sent malicious emails with lures related to the Russia-Ukraine conflict, including attachments labeled ??nformation on war criminals of the Russian Federation??and ??ecessary_military_assistance.??The emails contained malware which allowed Russian operators to conduct espionage.",Confirmation   https://cert.gov.ua/article/39086,Government agencies of EU member states,Russian Federation,Espionage,Government,https://www.bleepingcomputer.com/news/security/ukraine-spots-russian-linked-armageddon-phishing-attacks/,,
Targeting of Rostec,5/19/2022,Believed to be the work of the Chinese government,"A Chinese threat actor targeted two research institutes run by Rostec, a major Russian state-owned defense conglomerate. The attackers used spear-phishing lures to plant malware and steal data on Russian radar and electronic warfare capabilities.",,Two research institutes run by Rostec,China,Espionage,Government,https://blog.checkpoint.com/2022/05/19/twisted-panda-check-point-research-unveils-a-chinese-apt-espionage-campaign-against-russian-state-owned-defense-institutes/,,
Targeting of Albanian government,8/4/2022,Believed to be the work of the Iranian government,"Iranian threat actors targeted Albanian government networks with ransomware. The attack appears to have been motivated by Albania?? hosting a conference for the People?? Mojahedin Organization of Iran, a group previously listed as a terrorist organization by the European Union (EU) and United States and dedicated to opposing the Iranian regime.",Denouncement   https://twitter.com/JasonMBrodsky/status/1567465232083165184?s=20&amp;t=nJqgodp_ASXIZWex6LR3Ig,Albanian government networks,Iran (Islamic Republic of),Data destruction,Government,https://www.mandiant.com/resources/blog/likely-iranian-threat-actor-conducts-politically-motivated-disruptive-activity-against?1=,https://www.cisa.gov/uscert/ncas/alerts/aa22-264a,
Targeting of users of cryptocurrency applications,12/3/2022,Lazarus Group,"North Korean hacking group Lazarus created a fake brand called BloxHolder to spread fake cryptocurrency apps that would infect users with AppleJeus malware to steal money and cryptocurrency. The campaign was active from June to at least October 2022.
?",Unknown,Cryptocurrency applications,Korea (Democratic People's Republic of),Financial Theft,Private sector,https://www.volexity.com/blog/2022/12/01/buyer-beware-fake-cryptocurrency-applications-serving-as-front-for-applejeus-malware/,https://www.bleepingcomputer.com/news/security/hackers-use-new-fake-crypto-app-to-breach-networks-steal-cryptocurrency/,
Targeting of VMWare Horizon servers with Log4Shell vulnerability,2/18/2022,APT 35,"The Iranian threat actor APT 35 leveraged the Log4Shell vulnerability to run malicious PowerShell commands, deploy backdoors, steal credentials, and move laterally through systems.??",,VMware Horizon servers,Iran (Islamic Republic of),Espionage,Private sector,https://www.sentinelone.com/labs/log4j2-in-the-wild-iranian-aligned-threat-actor-tunnelvision-actively-exploiting-vmware-horizon/,https://www.bleepingcomputer.com/news/security/iranian-hackers-target-vmware-horizon-servers-with-log4j-exploits/,
Targeting of cryptocurrency company employees,4/19/2022,Lazarus Group,"North Korean hackers targeted cryptocurrency company employees in a phishing campaign to access systems and make fraudulent trades. Lazarus sent mass emails with job offers embedded with malicious links. When victims clicked, their devices downloaded TraderTraitor malware, which enabled the hackers to execute commands and infiltrate company networks to make fraudulent blockchain transactions.",Confirmation   https://www.cisa.gov/uscert/ncas/alerts/aa22-108a,Cryptocurrency company employees,Korea (Democratic People's Republic of),Financial Theft,Private sector,https://www.cisa.gov/uscert/ncas/alerts/aa22-108a,https://www.cyberscoop.com/tradertraitor-malware-warning-cisa-lazarus-group-north-korea/,
Targeting of individual suspects in serious criminal investigations within Canada,6/29/2022,Believed to be the work of the Canadian government,"The Royal Canadian Mounted Police (RCMP) has confirmed that it uses spyware to infiltrate the mobile devices of suspects in highly sensitive criminal and national security investigations. From 2018 to 2020, the RCMP said it used spyware in ten investigations.",,Individual suspects within Canadian police investigations.,Canada,Espionage,Civil society,https://www.politico.com/news/2022/06/29/canada-national-police-spyware-phones-00043092,,
Targeting of Ukrainian government agencies in espionage campaign,9/15/2022,Gamaredon,"Gamaredon, a Russian threat actor, was found using newly developed malware to steal information from Ukrainian government agencies. The malware was distributed through a phishing campaign.",Unknown,Ukrainian government agencies,Russian Federation,Espionage,Government,https://blog.talosintelligence.com/2022/09/gamaredon-apt-targets-ukrainian-agencies.html,,
Targeting of Israeli activist,1/20/2022,Believed to be the work of Israel's government.,The Israeli government used the NSO Group's spyware tool Pegasus to spy on an Israeli activist. The authorities allegedly catalogued his activity on a dating site for use as future leverage.?,Denial   https://www.calcalistech.com/ctech/articles/0%2C7340%2CL-3927606%2C00.html,An activist in Israel,Israel,Espionage,Civil society,https://www.calcalistech.com/ctech/articles/0%2C7340%2CL-3927606%2C00.html,,
Targeting of Ukrainian government and IT sector systems with WhisperGate malware,1/15/2022,Believed to be the work of the Russian government,"The Russian Army?? Main Intelligence Directorate (the GRU) used WhisperGate wiper malware on Ukrainian systems on January 13, 2022. The wiper masqueraded as ransomware, offering victims the chance to decrypt their data for a fee, while in reality, the malware wiped the system. The wiper was found on systems throughout Ukraine, including the foreign ministry and networks used by the Ukrainian cabinet.",,Ukrainian government and IT sector systems,Russian Federation,Data destruction,Government,https://www.microsoft.com/security/blog/2022/01/15/destructive-malware-targeting-ukrainian-organizations/,https://query.prod.cms.rt.microsoft.com/cms/api/am/binary/RE4Vwwd,
Targeting of Belgian Defense Ministry,7/18/2022,Gallium,"Chinese threat actors targeted the Belgian Defense Ministry as part of a wide-ranging cyberespionage campaign involving multiple threat actors, which also targeted the Interior Service. Belgian authorities condemned the activity.",Denouncement   https://diplomatie.belgium.be/en/news/declaration-minister-foreign-affairs-malicious-cyber-activities,Belgian Defense Ministry,China,Espionage,Military,https://diplomatie.belgium.be/en/news/declaration-minister-foreign-affairs-malicious-cyber-activities,,
Targeting of Uyghur populations,11/10/2022,Mirage,Chinese-affiliated threat actor APT 15 led a mobile surveillance campaign against Uyghurs in China and abroad using BadBazaar malware masquerading as Android apps.?,Unknown,Members of the Uyghur ethnic group,China,Espionage,Civil society,https://www.lookout.com/blog/uyghur-surveillance-campaign-badbazaar-moonshine,,
Targeting of Jordanian activists,4/5/2022,Believed to be the work of the Jordanian government,"The devices of at least four Jordanian human rights activists, lawyers, and journalists were infected with NSO Group?? Pegasus spyware between August 2019 and December 2021. Two Pegasus operators involved in the incident, named Mansaf and BlackIris, are likely connected to agencies of the Jordanian government.",,"Four Jordanian human rights defenders, lawyers, and journalists",Jordan,Espionage,Civil society,https://citizenlab.ca/2022/04/peace-through-pegasus-jordanian-human-rights-defenders-and-journalists-hacked-with-pegasus-spyware/,,
Targeting of Tibetans living abroad,6/1/2022,Lucky Cat,"A Chinese threat actor was found using a zero-day vulnerability, dubbed Follina, in Microsoft Office products to distribute zero-click malware. The attackers used Follina to target Tibetan organizations and Tibetans living abroad with malware.",,Tibetan organizations and Tibetans living abroad,China,Espionage,Civil society,https://www.bleepingcomputer.com/news/security/windows-msdt-zero-day-now-exploited-by-chinese-apt-hackers/,https://techcrunch.com/2022/06/01/china-backed-hackers-are-exploiting-unpatched-microsoft-zero-day/,
"Targeting of Australian, Malaysian, and European organizations and organizations operating in and around the South China Sea.",8/30/2022,APT 40,"APT 40 launched an espionage campaign targeting Australian, European, and Asian organizations involved in maintaining and producing wind turbines in the South China Sea, as well as Malaysian organizations working in the Kasawari gas field.",Unknown,"Australian, Canadian, German, Japanese, Norwegian, Swedish, and Taiwanese organizations involved in wind turbine maintenance and production, as well as Malaysian oil and gas refineries.",China,Espionage,"Government, Private sector",https://www.proofpoint.com/us/blog/threat-insight/chasing-currents-espionage-south-china-sea,https://www.bleepingcomputer.com/news/security/chinese-hackers-target-australian-govt-with-scanbox-malware/,https://therecord.media/china-linked-hackers-target-organizations-operating-in-south-china-sea/
"Targeting of Latvian, Lithuanian, and Ukrainian computer systems",2/23/2022,Sandworm,"Russian threat actors targeted computer systems in Latvia, Lithuania, and Ukraine with a wiper dubbed HermeticWiper. The malware was aimed at Windows devices, corrupting systems??master boot records, displaying signs of ransomware as a decoy, and destroying stored data. This followed another wiper attack aimed at Ukraine in January.?",,"Latvian, Lithuanian, and Ukrainian computer systems owned by banks and government contractors, as well as systems used by the defense, aviation, and IT sectors",Russian Federation,Data destruction,"Government, Civil society",https://www.cisa.gov/uscert/ncas/alerts/aa22-057a,https://www.sentinelone.com/labs/hermetic-wiper-ukraine-under-attack/,https://symantec-enterprise-blogs.security.com/blogs/threat-intelligence/ukraine-wiper-malware-russia
Targeting of journalists reporting on North Korea,4/21/2022,APT 37,"North Korea??inked threat actor APT 37 targeted journalists with novel Goldbackdoor malware. APT 37 initially used RokRat malware to hack the email account of a former director at South Korea?? National Intelligence Service. The hackers then impersonated the official and targeted South Korean journalists, sending emails laced with Goldbackdoor malware. The malware can be used to steal passwords and documents.",,Journalists and the former director of South Korea?? National Intelligence Service,Korea (Democratic People's Republic of),Espionage,Civil society,https://stairwell.com/news/threat-research-the-ink-stained-trail-of-goldbackdoor/,https://www.nknews.org/2022/04/north-korean-hackers-steal-ex-intelligence-officials-emails-in-malware-attack/,
Targeting of UN Interim Force in Lebanon (UNIFIL),6/29/2022,Believed to be the work of the Iranian government,The Israeli defense minister has accused Iran and Hezbollah of attempting a cyberattack against the UNIFIL to steal information about its activities within southern Lebanon.,Confirmation   https://www.timesofisrael.com/gantz-says-iran-and-hezbollah-attempted-to-hack-unifil-steal-deployment-infomation/,UN peacekeeping force in Lebanon,Iran (Islamic Republic of),Espionage,"Civil society, Military",https://www.timesofisrael.com/gantz-says-iran-and-hezbollah-attempted-to-hack-unifil-steal-deployment-infomation/,,
Targeting of Ukrainian networks via fake telecommunications firms,9/19/2022,Sandworm,"A Russian threat actor masqueraded as a Ukrainian telecommunications firm in order to gain access to other networks in Ukraine, both through spear-phishing and malicious public domains.",Unknown,Ukrainian telecommunications infrastructure and other firms,Russian Federation,Espionage,"Private sector, Government",https://www.recordedfuture.com/russia-nexus-uac-0113-emulating-telecommunication-providers-in-ukraine,,
Targeting of local Israeli officials,1/23/2022,Believed to be the work of Israel's government,"The signals intelligence unit of the Israeli police is suspected of using Pegasus spyware to surveil local officials and their families in Israel. The warrantless surveillance conducted with Pegasus was used to inform later prosecutions for bribery, some of which were dismissed in court for lack of evidence. The police attempted to cover up evidence that they had used Pegasus in the investigations.?",Unknown,Mayors and other local officials in Israel.,Israel,Espionage,Government,https://www.calcalistech.com/ctech/articles/0%2C7340%2CL-3927704%2C00.html,,
Targeting of Asus routers,3/17/2022,Sandworm,"Sandworm targeted WatchGuard and ASUS routers with Cyclops Blink malware, an advanced modular botnet. The malware gives Sandworm access to data and files stored on compromised networks. The malware affects devices??hat do not belong to critical organizations, suggesting that its purpose may be to build infrastructure for later attacks on high-value targets.?",Criminal charges   https://www.justice.gov/opa/pr/justice-department-announces-court-authorized-disruption-botnet-controlled-russian-federation,"Asus Routers in countries including the United States, Canada, India, Italy, and Russia",Russian Federation,Espionage,Private sector,https://www.trendmicro.com/en_us/research/22/c/cyclops-blink-sets-sights-on-asus-routers--.html,https://www.justice.gov/opa/pr/justice-department-announces-court-authorized-disruption-botnet-controlled-russian-federation,
"Targeting of government network in Vinnytsia, Ukraine",4/27/2022,APT 28,"APT 28 conducted phishing campaigns targeting the Ukrainian military and government employees. Strontium succeeded in compromising a government network in Vinnytsia, a city in western Ukraine.",,Government network in Vinnytsia,Russian Federation,Sabotage,Government,https://query.prod.cms.rt.microsoft.com/cms/api/am/binary/RE4Vwwd,,
Targeting of European Union (EU) member states,7/23/2022,APT 37,"A North Korean advanced persistent threat group used malware known as Konni, a remote-access Trojan, to hack into high-level organizations across the EU.",Unknown,"Czech Republic, Poland, and other EU countries",Korea (Democratic People's Republic of),Espionage,Government,https://www.bleepingcomputer.com/news/security/north-korean-hackers-attack-eu-targets-with-konni-rat-malware/,,
Targeting of Polish and Ukrainian transportation companies,11/10/2022,Sandworm,Russian threat actor Sandworm targeted transportation and logistics organizations in Ukraine and Poland with Prestige ransomware starting in October 2022.,Unknown,Ukrainian and Polish transportation companies,Russian Federation,Espionage,Private sector,https://www.microsoft.com/en-us/security/blog/2022/11/10/microsoft-threat-intelligence-presented-at-cyberwarcon-2022/,,
Antlion,2/2/2022,,Antlion is a Chinese threat actor suspected of targeting organizations in Taiwan using custom backdoors to deploy both custom and off-the-shelf malware. Antlion has conducted extended espionage campaigns against private sector companies.?,,Financial departments of Taiwanese private sector companies,,Espionage,Private sector,https://symantec-enterprise-blogs.security.com/blogs/threat-intelligence/china-apt-antlion-taiwan-financial-attacks,,
Targeting of Israeli officials,4/6/2022,APT-C-23,"Hamas-linked actor APT-C-23 targeted Israelis with an espionage campaign to exfiltrate sensitive information from individuals working in law enforcement, the military, and emergency services. The attackers used fabricated Facebook profiles to lure targets to install trojanized direct message applications.",,"Israeli individuals including a group of high-profile targets working for defense, law enforcement, and emergency services organizations","Palestine, State of",Espionage,Government,https://www.cybereason.com/blog/operation-bearded-barbie-apt-c-23-campaign-targeting-israeli-officials,https://www.bloomberg.com/news/articles/2022-04-06/hackers-posed-as-flirtatious-women-to-target-israeli-officials,
Targeting of Boston Children?? Hospital,6/1/2022,Believed to be the work of the Iranian government.,Iranian government-backed hackers are believed to have launched a ransomware attack against the Boston Children's Hospital in the summer of 2021. The attack was foiled after a partner country shared intelligence with the FBI.,Denouncement   https://www.wsj.com/articles/fbi-chief-blames-iran-for-cyberattack-on-boston-childrens-hospital-11654096382,Boston Children's Hospital,Iran (Islamic Republic of),Financial Theft,Private sector,https://www.wsj.com/articles/fbi-chief-blames-iran-for-cyberattack-on-boston-childrens-hospital-11654096382,https://www.bostonglobe.com/2022/06/01/business/hackers-linked-iran-targeted-boston-childrens-hospital-fbi-boss-says/,
Targeting of industrial enterprises and public institutions in Central Asia and Eastern Europe,8/8/2022,APT 18,"Chinese hackers used phishing emails to plant PortDoor malware on the systems of industrial organizations in Afghanistan, Belarus, Russia, and Ukraine. Security researchers detected the hackers exfiltrating data to a server with a Chinese IP address.",Unknown,"Industrial plants, design bureaus, research institutes, and government organizations in Afghanistan, Belarus, Russia, and Ukraine.",China,Espionage,"Government, Private sector",https://ics-cert.kaspersky.com/publications/reports/2022/08/08/targeted-attack-on-industrial-enterprises-and-public-institutions/,,
Targeting of Chinese users with three zero days,12/2/2022,Ocean Lotus,"Ocean Lotus, a Vietnamese APT, was found deploying three zero days on Chinese networks. The attacks were primarily directed at gaining and expanding access to routers, networks, and cameras in China. Ocean Lotus could have also incorporated some of the compromised devices into its Torii botnet.
?",Unknown,Chinese organizations and surveillance companies,Vietnam,Espionage,"Government, Civil society",https://mp.weixin.qq.com/s/2RluW4O56UWiNSQB2hQtGA,,
Targeting of Ukrainian and Polish military personnel,2/25/2022,UNC1151,"Belarusian threat actor UNC1151 targeted the private email addresses of Ukrainian soldiers in a phishing attack. UNC1151 hacked the email accounts of military personnel and then leveraged the compromised address books to send further malicious emails, many of which were sent to Polish military personnel.?",Confirmation   https://www.reuters.com/world/europe/ukraine-says-its-military-is-being-targeted-by-belarusian-hackers-2022-02-25/,Ukrainian and Polish military personnel,"Belarus, Russian Federation",Espionage,Military,https://blog.google/threat-analysis-group/update-threat-landscape-ukraine/,https://therecord.media/ukraine-says-belarusian-hackers-are-targeting-its-military-personnel/,
Targeting of Russian military officials,4/27/2022,Mustang Panda,"Chinese threat actor Mustang Panda targeted Russian government computer systems with PlugX malware. The malware was disguised in a malicious file masquerading as a PDF, which was named after a Russian border guard unit.",,Russian officials??computer systems,China,Espionage,"Government, Military",https://www.cyberscoop.com/chinese-hacking-russia-ukraine-bronze-president/,https://www.secureworks.com/blog/bronze-president-targets-russian-speakers-with-updated-plugx,
Targeting of Hungarian Foreign Ministry networks,3/29/2022,Believed to be the work of the government of the Russian Federation.,The Federal Security Service and the Russian military intelligence agency have conducted cyberattacks against the Hungarian Foreign Ministry since at least 2012 to retrieve critical information Hungary?? diplomatic relations with the North Atlantic Treaty Organization and the European Union (EU).,Confirmation   https://www.direkt36.hu/en/putyin-hekkerei-is-latjak-a-magyar-kulugy-titkait-az-orban-kormany-evek-ota-nem-birja-elharitani-oket/,Hungarian Foreign Ministry,Russian Federation,Espionage,Government,https://www.direkt36.hu/en/putyin-hekkerei-is-latjak-a-magyar-kulugy-titkait-az-orban-kormany-evek-ota-nem-birja-elharitani-oket/,,
Targeting of governments in the Middle East and Africa,9/29/2022,APT 10,APT 10 installed web shells on public-facing servers and extracted information from Middle Eastern governments and an African stock exchange.,Unknown,Two Middle Eastern countries and one African stock exchange,China,Espionage,Government,https://symantec-enterprise-blogs.security.com/blogs/threat-intelligence/witchetty-steganography-espionage,,
Earth Lusca,1/17/2022,,"Earth Lusca is a threat actor that targets organizations of interest to the Chinese government, including academic institutions, telecommunication companies, religious organizations, and other civil society groups. Earth Lusca's tools closely resemble those used by Winnti Umbrella, but the group appears to operate separately from Winnti. Earth Lusca has also been observed targeting cryptocurrency payment platforms and cryptocurrency exchanges in what are likely financially motivated attacks.?",,"Academic institutions, government research organizations, religious groups, cryptocurrency exchanges, and other financial and civil society organizations.",China,Espionage,"Government, Civil society, Private sector",https://www.trendmicro.com/en_id/research/22/a/earth-lusca-sophisticated-infrastructure-varied-tools-and-techni.html,https://www.trendmicro.com/content/dam/trendmicro/global/en/research/22/a/earth-lusca-employs-sophisticated-infrastructure-varied-tools-and-techniques/technical-brief-delving-deep-an-analysis-of-earth-lusca-operations.pdf,
