Title,Date,Affiliations,Description,Response,Victims,Sponsor,Type,Category,Sources_1,Sources_2,Sources_3
"Targeting of civil society groups in Nepal, the Philippines, Taiwan, and Hong Kong",7/9/2021,"TAG-22, Winnti Umbrella","Chinese state-sponsored hackers were detected infiltrating networks in Nepal, the Philippines, Taiwan, and Hong Kong, with a focus on academic and governmental networks.",,"Governments, academics, and research and development institutions across Nepal, the Philippines, Taiwan, and Hong Kong",China,Espionage,"Government, Civil society",https://www.recordedfuture.com/chinese-group-tag-22-targets-nepal-philippines-taiwan/,https://www.cyberscoop.com/chinese-apt-hacking-taiwan-semiconductor/,
Targeting of South Korean company recruiters,11/30/2021,Lazarus Group,Hackers from the North Korean Lazarus Group sent malware disguised as job openings at Samsung to engineers. These attacks followed a methodology similar to that of a July 2021 Lazarus Group campaign against engineering firms in South Korea.?,,Engineers were targeted in the hopes that Lazarus Group would access the systems of South Korean engineering and defense companies.,Korea (Democratic People's Republic of),Espionage,Private sector,https://services.google.com/fh/files/misc/gcat_threathorizons_full_nov2021.pdf,https://therecord.media/north-korean-hackers-posed-as-samsung-recruiters-to-target-security-researchers/,
Domestic Kitten,2/8/2021,,Iranian APT believed to be primarily involved in domestic surveillance.,,"Internal dissidents, opposition forces, self-proclaimed Islamic State advocates, and Kurds, among others",Iran (Islamic Republic of),Espionage,Civil society,https://research.checkpoint.com/2021/domestic-kitten-an-inside-look-at-the-iranian-surveillance-operations/,https://research.checkpoint.com/2018/domestic-kitten-an-iranian-surveillance-operation/,
Targeting of U.S. Agency for International Development,5/27/2021,Nobelium,The Russian hacking group Nobelium compromised the company hosting the servers for the U.S. Agency for International Development (USAID) and used its access to send phishing emails to other aid groups.,Confirmation   https://www.cisa.gov/uscert/ncas/alerts/aa21-148a,U.S. Agency for International Development (USAID),Russian Federation,Espionage,"Government, Civil society",https://www.microsoft.com/security/blog/2021/05/27/new-sophisticated-email-based-attack-from-nobelium/,https://www.nytimes.com/2021/05/28/us/politics/russia-hack-usaid.html?web_view=true,
Targeting of manufacturing groups across Asia,8/12/2021,"Aggah, Gorgon Group","The Pakistani-linked APT Aggah launched a spear-phishing campaign in early 2021 that targeted manufacturing firms in Taiwan and South Korea, as well as other countries.",,Manufacturing companies in Taiwan and South Korea.,Pakistan,Espionage,Private sector,https://www.anomali.com/blog/aggah-using-compromised-websites-to-target-businesses-across-asia-including-taiwan-manufacturing-industry,https://threatpost.com/aggah-wordpress-spearphishing/168657/?web_view=true,
Targeting of various industries through Gmail compromises,10/7/2021,APT 28,"APT28 was detected conducting a wide-ranging phishing attack against more than fourteen thousand Gmail users who work as activists, journalists, and national security officials.?",,"More than fourteen thousand Gmail users who work as activists, journalists, or national security professionals.",Russian Federation,Espionage,"Civil society, Government",https://therecord.media/google-notifies-14000-gmail-users-of-targeted-apt28-attacks/,,
Targeting of India?? power infrastructure,2/28/2021,Winnti Umbrella,"Amid mounting border tensions between China and India in 2020, Chinese threat actors allegedly infected India?? power grid?? control systems with malware.",,Ten distinct Indian power-sector organizations,China,Sabotage,Government,https://www.recordedfuture.com/redecho-targeting-indian-power-sector/,https://www.nytimes.com/2021/02/28/us/politics/china-india-hacking-electricity.html,
Targeting of Polish members of parliament's email accounts,6/18/2021,UNC1151,"In a campaign known as Ghostwriter, Polish politicians' personal email accounts were targeted by hackers who stole classified documents. The Polish government has said Russia was behind the attack, a claim disputed by Mandiant, which attributes the attack to Belarus.",,Polish members of parliament,Belarus,Espionage,Government,https://www.mandiant.com/resources/unc1151-linked-to-belarus-government,https://www.reuters.com/world/europe/cyber-attack-polish-officials-came-russia-kaczynski-says-2021-06-18/,
Calypso,9/28/2021,,"Calypso has been observed targeting government agencies worldwide since 2016, including institutions in Brazil, Indonesia, Russia, Thailand, and Turkey. The group was also implicated in a breach of Afghan telecommunication company Roshan.",,"Roshan, a major Afghan telecommunication company, as well asgovernment agencies in Brazil, Indonesia, Russia, Thailand, and Turkey",China,Espionage,"Private sector, Government",https://www.ptsecurity.com/ww-en/analytics/calypso-apt-2019/,,
Targeting of security researchers with malware,1/25/2021,Lazarus Group,North Korean hackers used spear-phishing social media techniques to target security researchers to install malware onto targets??Windows systems.?,,Cybersecurity research community,Korea (Democratic People's Republic of),Espionage,"Private sector, Civil society",https://blog.google/threat-analysis-group/new-campaign-targeting-security-researchers/,https://www.zdnet.com/article/google-north-korean-hackers-have-targeted-security-researchers-via-social-media/,https://blog.google/threat-analysis-group/update-campaign-targeting-security-researchers/
Targeting of the Vietnamese and Thai governments and military,4/5/2021,Emissary Panda,"APT 27 conducted a wide-ranging espionage campaign to gather data from a variety of institutions throughout Southeast Asia, primarily concentrated in Vietnam.",,"Vietnamese government, military, and civil society institutions along with comparable institutions in Thailand",China,Espionage,"Government, Military, Civil society",https://www.kaspersky.com/about/press-releases/2021_advanced-threat-actors-engaged-in-cyberespionage-in-apac-up-their-game-in-new-campaign,,
Targeting of academics focusing on the Middle East,7/13/2021,"TA453, Charming Kitten",Charming Kitten was found using spear-phishing attacks against UK experts who study the Middle East. The attacks involved impersonating scholars from the University of London's School of Oriental and African Studies and prompted the victims to either turn over sensitive information or download malware onto their systems.,,Researchers in the United Kingdom focused on the Middle East,Iran (Islamic Republic of),Espionage,"Civil society, Private sector",https://www.proofpoint.com/us/blog/threat-insight/operation-spoofedscholars-conversation-ta453,,
Targeting of Afghan government and military,12/22/2021,APT 36,"A Pakistani threat actor launched a series of spear-phishing attacks against the Afghan government. The attackers stole personal information from high-level diplomats and military officials, including names, email addresses, and diplomatic visa forms.?",,Afghan government and military officials,Pakistan,Espionage,"Government, Military",https://about.fb.com/news/2021/11/taking-action-against-hackers-in-pakistan-and-syria/,https://cyware.com/news/sidecopy-apt-targets-indian-and-afghan-governments-16b376a5,
Targeting of domestic citizens in Iran,2/8/2021,Domestic Kitten,"Iranian APT Domestic Kitten used spyware FurBall to surveil domestic citizens and anyone considered a threat to Tehran. Campaigns have been ongoing since 2017, with the latest launched in November 2020.",,"Internal dissidents, opposition forces, self-proclaimed Islamic State advocates, and Kurds, among others",Iran (Islamic Republic of),Espionage,Civil society,https://research.checkpoint.com/2018/domestic-kitten-an-iranian-surveillance-operation/,https://research.checkpoint.com/2021/domestic-kitten-an-inside-look-at-the-iranian-surveillance-operations/,
Targeting of South Korean government,6/1/2021,Kimsuky,"The South Korean government was targeted in a wide-ranging attack by North Korean threat actors. The attacks installed the AppleSeed backdoor, which was used to exfiltrate information.",,"South Korean Ministry of Trade, Industry, and Energy; South Korean Ministry of Foreign Affairs; Consulate of South Korea in Hong Kong; and the Embassy of Sri Lanka in Seoul",Korea (Democratic People's Republic of),Espionage,Government,https://blog.malwarebytes.com/threat-intelligence/2021/06/kimsuky-apt-continues-to-target-south-korean-government-using-appleseed-backdoor/?web_view=true,,
Targeting of Air India,8/12/2021,"APT 41, Barium, TA415","While investigating a breach of Air India's data systems, cybersecurity researchers stumbled on a previously undetected intrusion into Air India's systems likely carried out by Chinese threat actors.",,Air India,China,Espionage,Private sector,https://blog.group-ib.com/colunmtk_apt41,,
Targeting of South Korean think tank,10/26/2021,Lazarus Group?,"Using an unusual route to gain access to civil society and government groups, North Korean hackers accessed the servers of a South Korean think tank by compromising a Latvian company providing third-party services.?",,A Latvian technology company and a South Korean think tank,Korea (Democratic People's Republic of),Espionage,Civil society,https://securelist.com/apt-trends-report-q3-2021/104708/,https://www.cpomagazine.com/cyber-security/north-korean-lazarus-hacking-group-leverages-supply-chain-attacks-to-distribute-malware-for-cyber-espionage/,
Targeting of organizations via Microsoft Exchange Server vulnerability,3/2/2021,Hafnium,The Chinese threat actor Hafnium exploited vulnerabilities in the Microsoft Exchange Server to access the emails of hundreds of thousands of entities across the globe.,,"Various industry sectors, including state and local governments, universities, defense contractors, law firms, medical researchers, think tanks, and others",China,Espionage,"Civil society, Private sector, Government",https://www.microsoft.com/security/blog/2021/03/02/hafnium-targeting-exchange-servers/,https://www.volexity.com/blog/2021/03/02/active-exploitation-of-microsoft-exchange-zero-day-vulnerabilities/,
Targeting of Norwegian government's IT network,6/19/2021,"APT 31, Hurricane Panda","An investigation by the Norwegian Police Security Service (PST) found that a 2018 breach of the government's IT systems was carried out by a Chinese threat actor. The hackers removed large amounts of data in the breach, although the PST is still unsure of exactly how much data or what files were taken",,Norwegian government and its IT system,China,Espionage,Government,https://therecord.media/norway-says-chinese-group-apt31-is-behind-catastrophic-2018-government-hack/,https://www.nrk.no/norge/pst_-har-etterretning-om-at-kinesisk-gruppe-stod-bak-dataangrep-mot-statsforvaltere-1.15540601,
Targeting of Afghan telecommunication firm Roshan,9/28/2021,Calypso,"An email server controlled by the Afghan telecommunication company Roshan was targeted by a Chinese threat actor since at least early 2021. Calypso?? data exfiltration activity spiked in August and September 2021, coinciding with the United States military?? withdrawal from Afghanistan.",,"Roshan, a major Afghan telecommunication company",China,Espionage,Private sector,https://www.recordedfuture.com/chinese-APT-groups-target-afghan-telecommunications-firm/?__hstc=156209188.bb009bd700ffdb42f1bd71351aa875c2.1628778103997.1632758893662.1632844704571.22&__hssc=156209188.1.1632844704571&__hsfp=4085325968,,
Take down of EMOTET botnet,1/27/2021,"Law enforcement agencies in the United States, Canada, France, Germany, Lithuania, the Netherlands, Ukraine, and United Kingdom",An international coalition of law enforcement authorities successfully took down notorious criminal botnet EMOTET by taking control of its command-and-control servers.,,EMOTET cybercriminal group,"United States, Canada, France, Germany, Lithuania, Netherlands, Ukraine, United Kingdom",Sabotage,Civil society,https://www.europol.europa.eu/media-press/newsroom/news/world%e2%80%99s-most-dangerous-malware-emotet-disrupted-through-global-action,,
Targeting of South African freight companies,4/8/2021,Lazarus Group,"Vyveva, a known Lazarus Group malware tool, was spotted in the systems of South African shipping companies. The malware appears designed to facilitate file transfers.",,South African shipping companies,Korea (Democratic People's Republic of),Espionage,Private sector,https://www.welivesecurity.com/2021/04/08/are-you-afreight-dark-watch-out-vyveva-new-lazarus-backdoor/?web_view=true,,
Targeting of Philippine and Nepalese governments,7/14/2021,"HoneyMyte, Mustang Panda, Bronze President","Kaspersky Labs detected a high-volume campaign in Southeast Asia primarily aimed at government agencies in Myanmar, Nepal, and the Philippines. The attackers used a compromised version of the popular video conference application Zoom to break into computers.",,"Government agencies in Myanmar, Nepal, and the Philippines",China,Espionage,Government,https://securelist.com/apt-luminousmoth/103332/,https://www.bleepingcomputer.com/news/security/chinese-cyberspies-wide-scale-apt-campaign-hits-asian-govt-entities/?web_view=true,
Targeting of Pfizer vaccine data,2/16/2021,North Korean government,South Korean lawmaker Ha Tae-keung told reporters that North Korean hackers attempted to steal COVID-19 vaccine data from U.S. pharmaceutical company Pfizer. It is unclear whether the alleged operation was successful.,,Pfizer,Korea (Democratic People's Republic of),Espionage,Private sector,https://www.washingtonpost.com/world/asia_pacific/north-korea-pfizer-coronavirus-vaccine-hack/2021/02/16/c09ec7fc-702e-11eb-8651-6d3091eac63f_story.html,https://www.reuters.com/article/us-northkorea-cybercrime-pfizer-idUKKBN2AG0NI,
Targeting of Myanmar's presidential website,6/2/2021,Winnti Umbrella,The Chinese hacking group Red Echo inserted malicious code into a download link on the webpage for Myanmar's president. This marks the second time Myanmar?? presidential website has been used in watering-hole attacks by Chinese hackers.,,Visitors to Myanmar's presidential webpage,China,Espionage,"Government, Civil society",https://therecord.media/backdoor-malware-found-on-the-myanmar-presidents-website-again/?web_view=true,https://cyberintelmag.com/malware-viruses/backdoor-planted-on-the-myanmar-presidents-website/,
Targeting of Slovakian government agencies,8/13/2021,"Nobelium, APT 29",Nobelium launched spear-phishing attacks against Slovakian diplomats by posing as the Slovak National Security Authority.,,Slovakian diplomats,Russian Federation,Espionage,Government,https://www.istrosec.com/blog/apt-sk-cobalt/,https://therecord.media/russian-cyberspies-targeted-slovak-government-for-months/?web_view=true,
Emennet Pasargad,11/18/2021,Believed to be the work of the Iranian government.,An Iranian company hired by the Iranian government to interfere in U.S. elections. Emennet Pasargad has attacked voting-related websites and news outlets and distributed misinformation designed to undermine confidence in the U.S. electoral system.?,Sanctions   https://home.treasury.gov/news/press-releases/jy0494,Organizations related to the U.S. electoral process and news outlets.,Iran (Islamic Republic of),Espionage,"Civil society, Government",https://www.ic3.gov/Media/News/2022/220126.pdf,,
Hafnium,3/2/2021,,"The Chinese APT believed to be behind the exploitation of vulnerabilities in the Microsoft Exchange email server to access user emails. Historically, Hafnium has primarily targeted entities in the United States.",,"Various industry sectors, including state and local governments, universities, defense contractors, law firms, medical researchers, think tanks, and others",China,Espionage,"Civil society, Private sector, Government",https://blogs.microsoft.com/on-the-issues/2021/03/02/new-nation-state-cyberattacks/,,
Targeting of government and energy organizations in India and Afghanistan,6/22/2021,Pakistan,Pakistani threat actors compromised Indian government organizations and energy suppliers with open-source remote access Trojan horses.,,Indian government agencies and energy providers,Pakistan,Espionage,"Government, Private sector",https://blog.lumen.com/suspected-pakistani-actor-compromises-indian-power-company-with-new-reverserat/,,
Targeting of South Korean companies with ransomware,6/15/2021,Lazarus Group,North Korean hackers launched ransomware attacks on South Korean businesses. The malware used is an old incarnation of Lazarus Group?? espionage tools with added ransomware functionality.?,,South Korean corporations,Korea (Democratic People's Republic of),Espionage,Private sector,https://securelist.com/andariel-evolves-to-target-south-korea-with-ransomware/102811/?web_view=true,,
Disruption of NetWalker ransomware,1/27/2021,"Federal Bureau of Investigation, Bulgarian National Investigative Service","U.S. and Bulgarian authorities disrupted the NetWalker ransomware in a coordinated effort that disabled dark web resources and led to the arrest of a Canadian citizen and the seizure of approximately $500,000 in cryptocurrency delivered by victims as ransomware payments.",,Cybercriminals behind NetWalker ransomware,"United States, Bulgaria",Sabotage,Civil society,https://www.zdnet.com/article/us-and-bulgarian-authorities-dirsupt-netwalker-ransomware-operation/,https://www.justice.gov/opa/pr/department-justice-launches-global-action-against-netwalker-ransomware?utm_campaign=wp_the_cybersecurity_202&utm_medium=email&utm_source=newsletter&wpisrc=nl_cybersecurity202,
Targeting of Lebanese job seekers,4/8/2021,"APT 34, OilRig",Lebanese job seekers were sent a compromised pdf document claiming to be an offer from an American IT firm. The exact targets of this phishing campaign remain unclear.,,Job seekers in Lebanon,Iran (Islamic Republic of),Espionage,Civil society,https://research.checkpoint.com/2021/irans-apt34-returns-with-an-updated-arsenal/,,
Targeting of U.S. defense industry using Facebook,7/15/2021,"Tortoiseshell, ?Charming Kitten",Iran was accused of attempting to break into the personal accounts of over two hundred senior defense personnel in the United States and United Kingdom. The individuals were targeted in phishing attacks.,,Individuals in the defense industry in the United States and United Kingdom,Iran (Islamic Republic of),Espionage,Military,https://about.fb.com/news/2021/07/taking-action-against-hackers-in-iran/,https://www.cbsnews.com/news/facebook-iran-hackers-us-military-defense-contractors-fake-accounts/?web_view=true,
Targeting of French public organizations,12/7/2021,The Dukes,"Nobelium, a Russian threat actor, is believed to have compromised the servers of several French organizations as early as February 2021 to launch spear-phishing attacks against foreign organizations.?",,French civil society organizations with significant foreign ties.,Russian Federation,Espionage,Civil society,https://securityaffairs.co/wordpress/125342/apt/nobelium-targets-french-orgs.html?web_view=true,https://www.cert.ssi.gouv.fr/cti/CERTFR-2021-CTI-010/,
Targeting of French IT monitoring company,2/15/2021,Sandworm,Russian APT Sandworm used two different malware strains to hack the IT monitoring software of French cybersecurity firm Centreon. The hacking campaign lasted from 2017 to 2020 and only affected entities using the open-source version of Centreon?? software.,,"Fifteen entities, including France?? Ministry of Justice, that used Centreon?? outdated, open-source services",Russian Federation,Espionage,Private sector,https://www.cert.ssi.gouv.fr/uploads/CERTFR-2021-CTI-005.pdf,https://www.centreon.com/en/blog/centreon-provides-clarification-following-the-publication-of-the-anssi-report/,
Targeting of Southeast Asian ministry of foreign affairs,6/3/2021,Sharp Panda,A South Asian government was targeted as part of a long-running cyber espionage campaign carried out by a Chinese threat actor. The campaign used spear phishing to drop malware onto the government's systems.,,A South Asian foreign ministry,China,Espionage,Government,https://research.checkpoint.com/2021/chinese-apt-group-targets-southeast-asian-government-with-previously-unknown-backdoor/,,
Watering-hole attack on popular North Korean news site,8/18/2021,"APT 37, ScarCruft, Stardust Chollima",North Korea launched watering-hole attacks from popular anti-North Korea website the Daily NK.,,Visitors to the Daily NK website,Korea (Democratic People's Republic of),Espionage,Civil society,https://securelist.com/scarcruft-surveilling-north-korean-defectors-and-human-rights-activists/105074/,https://thehackernews.com/2021/11/new-chinotto-spyware-targets-north.html,
Targeting of U.S. newspaper chain,11/18/2021,Emennet Pasargad?,Iranian hackers are accused of compromising a major U.S. newspaper before the 2020 election.?,Sanctions   https://home.treasury.gov/news/press-releases/jy0494,A U.S. newspaper owned by Lee Enterprises.,Iran (Islamic Republic of),Espionage,Civil society,https://home.treasury.gov/news/press-releases/jy0494,,
Targeting of Indian vaccine makers,3/1/2021,APT 10,APT 10 targeted Indian vaccine makers Bharat Biotech and the Serum Institute of India for espionage purposes.?,,Indian vaccine makers Bharat Biotech and the Serum Institute of India,China,Espionage,Private sector,https://www.reuters.com/article/health-coronavirus-india-china/update-1-chinese-hackers-target-indian-vaccine-makers-sii-bharat-biotech-says-security-firm-idUSL2N2KZ13L,,
UNC1151,4/28/2021,"Belarus, Ghostwriter.","UNC1151 has been identified as the group orchestrating a long-running espionage campaign, known as Ghostwriter, across various east European countries focused on compromising governments??communications systems and gathering data that can be used in ongoing information warfare campaigns.",,The communications systems of east European governments,Belarus,Espionage,Government,https://www.mandiant.com/resources/espionage-group-unc1151-likely-conducts-ghostwriter-influence-activity,,
MalKamak,10/6/2021,,MalKamak was first discovered conducting a long-term espionage campaign against aerospace and telecommunication companies using Dropbox servers to stealthily exfiltrate data.?,,"Aerospace and telecommunication companies across the United States, Russia, the Middle East, and Europe",Iran (Islamic Republic of),Espionage,Private sector,https://www.cybereason.com/blog/operation-ghostshell-novel-rat-targets-global-aerospace-and-telecoms-firms,,
Targeting of international gambling firms,1/6/2021,Emissary Panda,"Chinese threat actor Emissary Panda locked the servers of five gambling firms marketing to Chinese nationals, requesting $100 million in ransom payment. The victim companies reported that no payment was made.",,Online gambling firms,China,Espionage,Private sector,https://shared-public-reports.s3-eu-west-1.amazonaws.com/APT27+turns+to+ransomware.pdf,https://www.gamblingnews.com/news/chinese-state-backed-hackers-target-gambling-companies-in-100m-ransomware-attack/,https://calvinayre.com/2021/01/06/business/china-state-sponsored-hackers-online-gambling-ransomware/
Targeting of U.S. oil and gas companies,7/20/2021,Comment Crew,"The U.S. Cybersecurity and Infrastructure Security Agency released the indicators of compromise for a series of attacks on U.S. oil and gas companies, which lasted from 2011 to 2013. The agency confirmed that at least twenty companies had been compromised and that the depth of the intrusions was not entirely clear.",,U.S. oil and gas companies,China,Espionage,Private sector,https://www.cisa.gov/uscert/ncas/alerts/aa21-201a,https://abcnews.go.com/Blotter/mandiant-report-fingers-chinese-military-us-hack-attacks/story?id=18537307,
Targeting of telecommunication companies in Asia and the Middle East,12/14/2021,MuddyWater,"Iran launched an espionage campaign directed against telecommunication companies throughout Asia and the Middle East. The attacks could have been aimed at inserting malware into the supply chain, although the exact purpose is unclear.?",,Telecommunication companies in Asia and the Middle East,Iran (Islamic Republic of),Espionage,,https://symantec-enterprise-blogs.security.com/blogs/threat-intelligence/espionage-campaign-telecoms-asia-middle-east,https://threatpost.com/seedworm-attackers-telcos-asia-middle-east/176992/?web_view=true,
Targeting of cryptocurrency exchanges and financial service companies,2/17/2021,Lazarus Group,North Korean APT Lazarus Group disseminated cryptocurrency trading applications outfitted with the AppleJeus malware. AppleJeus was used to steal cryptocurrency from unsuspecting victims in over thirty countries in 2020.,,"Cryptocurrency trading firms, various individuals, and financial services institutions",Korea (Democratic People's Republic of),Financial Theft,"Private sector, Civil society",https://www.cisa.gov/uscert/ncas/alerts/aa21-048a,,
